[
  {
    "confidence": "verified",
    "evidence_type": "source_file",
    "id": "ev.shared",
    "path": "src/shared.js",
    "path_only": false,
    "reason": "Shared source file cited by alpha packet.",
    "sha256": "aaaaaaaaaaaaaaaaaaaaaaaaaaaaaaaaaaaaaaaaaaaaaaaaaaaaaaaaaaaaaaaa"
  },
  {
    "confidence": "verified",
    "evidence_type": "config_file",
    "id": "ev.config",
    "path": "config/app.json",
    "path_only": false,
    "reason": "Config file cited by alpha packet.",
    "sha256": "bbbbbbbbbbbbbbbbbbbbbbbbbbbbbbbbbbbbbbbbbbbbbbbbbbbbbbbbbbbbbbbb"
  }
]
